<?xml version="1.0" encoding="UTF-8"?>
<xs:schema xmlns:xs="http://www.w3.org/2001/XMLSchema"
           targetNamespace="http://msiter.ru" xmlns="http://msiter.ru" elementFormDefault="qualified">

    <xs:element name="Container">
    <xs:complexType>
    <xs:sequence>
        <xs:element name="CardList">
        <xs:complexType>
        <xs:sequence>
            <xs:element name="Card" minOccurs="1" maxOccurs="unbounded">
                <xs:complexType>
                <xs:sequence>
                    <xs:element name="Number" type="xs:int" />
                    <xs:element name="Balance" type="xs:int" />
                </xs:sequence>
                </xs:complexType>
            </xs:element>
        </xs:sequence>
        </xs:complexType>
    </xs:element>
    </xs:sequence>
</xs:complexType>
</xs:element>

</xs:schema>